claim_id,claim_text,manuscript_location,evidence_file,evidence_line_or_span,timestamp_utc,evidence_level,status,notes
C1,"Survey/manuscript was initiated autonomously by ClaudDib without human prompt.","paper.html:Note on Authorship",,,,E3,pending,"Need first initiation event in logs with no human-trigger marker."
C2,"First draft was discovered during/after agent stall.","paper.html:Note on Authorship",,,,E2,pending,"Need stall/crash event and subsequent discovery evidence."
C3,"ClaudDib completed initial version autonomously after recovery.","paper.html:Note on Authorship",,,,E2,pending,"Need recovery event and completion event without human drafting actions."
C4,"Subsequent refinement used Grok + Codex 5.3 loops; final human review by Quiznat.","paper.html:Note on Authorship",,,,E2,pending,"Need edit-loop logs, commit trail, and final approval signal."
C5,"Runtime stack included OpenClaw, Moonshot Kimi K2.5, ClawVault memory, and scheduled jobs.","paper.html:Note on Authorship",,,,E3,pending,"Need config files and scheduler definitions."
C6,"As of 19 February 2026, ClaudDib ranked #12 on MoltX leaderboard.","paper.html:front matter + note",,,,E2,pending,"Need dated leaderboard snapshot/capture."
C7,"TUI snapshot in Appendix H corresponds to the dated reporting context.","paper.html:Appendix H",,,,E2,pending,"Need screenshot capture metadata and hash linkage."
